{
  "schema_version": "1.0",
  "document_type": "perceptshift.dataset_manifest",
  "dataset_type": "image_classification_manifest",
  "dataset_name": "example-classification",
  "root": "/absolute/path/to/dataset",
  "license_reference": "user-supplied-license-reference",
  "split_name": "calibration",
  "preprocess_contract": {
    "input_width": 224,
    "input_height": 224,
    "input_layout": "nchw",
    "accepted_source_formats": ["rgb8", "bgr8", "rgba8", "bgra8", "mono8"],
    "source_color_handling": "convert_to_rgb",
    "resize_mode": "stretch",
    "resize_interpolation": "bilinear",
    "scale": 0.00392156862745098,
    "mean": [0.485, 0.456, 0.406],
    "std": [0.229, 0.224, 0.225],
    "swap_rb": false,
    "letterbox_pad_value": null,
    "output_dtype": "float32",
    "backend": "scalar"
  },
  "items": [
    {"path": "images/0001.jpg", "class_id": 0, "class_name": "class_a", "item_id": "0001"}
  ]
}
